calories,carbs,cook_time,directions_steps,fat,image,ingredients_list,prep_time,protein,recipe_tip,servings,subheading,title,total_time,yield_result
,,3 hrs,"Preheat the oven to 350 degrees F (175 degrees C).,Remove and discard giblets. Rinse turkey and pat dry. Place turkey upside-down (with breast facing down) in a roasting pan.,Place 1/2 of the butter in the cavity of the turkey. Cut remaining butter into pieces and rub over the outside of the skin. Pour water into the pan and cover with foil.,Cook in the preheated oven until the internal temperature of the thighs has reached 180 degrees F (80 degrees C), 3 to 3 1/2 hours.",,"




","1 (12 pound) whole turkey,½ cup butter,1 cup water",20 mins,,"
When the turkey is done, you can use the pan juices to prepare a gravy. Just add cornstarch, 1 tablespoon at a time, until the liquid begins to thicken.",8,"
An upside-down turkey may seem to go against normal conventions of roasting breast-side up, but this method lets all the juices drip down into the breast meat, keeping it moist and tender. With only butter inside the cavity and under the skin to enhance its natural flavor, this holiday turkey without stuffing is so easy!","
Upside-Down Turkey",3 hrs 20 mins,
,,,"In a large mug, mix the hot chocolate mix, chocolate syrup, cinnamon, and chili powder. Pour in the milk. Add the boiling water and stir.nn",,"




","3 tablespoons instant hot chocolate mix,1 tablespoon chocolate syrup,½ teaspoon ground cinnamon,1 pinch chili powder,¼ cup milk,¾ cup boiling water",10 mins,,,2,"
This is an easy way to spice up regular hot chocolate mix. Add more or less of each ingredient, depending on taste. Serve with marshmallows or whipped cream and enjoy.","
Easy Mexican Hot Chocolate",10 mins,2 servings
,,45 mins,"Preheat the oven to 350 degrees F (175 degrees C). Grease and flour a 9x13-inch pan. Sift flour, baking soda, cinnamon, and salt into a bowl; set aside.,Combine apples and white sugar in a separate bowl; set aside. Mix brown sugar, oil, eggs, and vanilla together until well combined. Stir in apple mixture, then flour mixture. Fold in walnuts.,Pour batter into prepared pan. Bake in the preheated oven for 45 minutes, or until a toothpick inserted into the center of the cake comes out clean. Allow to cool.",,,"3 cups all-purpose flour,1 teaspoon baking soda,1 teaspoon ground cinnamon,½ teaspoon salt,3 apples - peeled, cored and sliced,1 cup white sugar,1 cup brown sugar,1 ¼ cups vegetable oil,2 large eggs,2 teaspoons vanilla extract,1 cup chopped walnuts",25 mins,,,12,"
This apple walnut cake is lovely and moist with wonderful flavor that improves the next day. Needs no frosting.","
Fresh Apple Walnut Cake",1 hr 10 mins,1 (9x13-inch) cake
,,2 hrs,"Prepare an outdoor grill for indirect medium-high heat.,Remove and discard giblets. Rinse turkey and pat dry. Turn wings back to hold neck skin in place. Return legs to a tucked position.,Brush turkey with oil. Season inside and out with Italian seasoning, salt, and pepper. Place turkey, breast-side up, on a metal grate inside a large roasting pan.,Place the roasting pan over indirect heat on the preheated grill. Grill until the internal thigh temperature is 180 degrees F (85 degrees C), 2 to 3 hours.,Remove from the grill and let turkey stand 15 minutes before carving.",,"




","1 (12 pound) whole turkey,1 tablespoon vegetable oil,1 teaspoon Italian seasoning, or more to taste,salt and ground black pepper to taste",15 mins,,"
If you want to use the turkey drippings for gravy, place a metal pan under turkey inside the roasting pan. Add 1/2 cup water to the metal pan, and more as necessary during grilling, to prevent the drippings from scorching. Remove the pan about 30 minutes before turkey is done cooking.",8,"
Learn how to grill a turkey for Thanksgiving with this easy recipe. Although not very traditional, cooking turkey on the grill is the best way to ensure tender and juicy meat and crispy skin every time. With minimal prep time and extra space in the oven for all your holiday sides, this grilled turkey recipe is one to try!","
The Greatest Grilled Turkey",2 hrs 30 mins,
,,3 hrs,"Gather all ingredients.,Preheat the oven to 325 degrees F (165 degrees C). Clean turkey and pat dry with paper towels. Place in a roasting pan with a lid.,Combine olive oil, garlic powder, basil, sage, salt, and pepper in a small bowl. Use a basting brush to apply the herb mixture all over the outside of the uncooked turkey. Pour 2 cups water into the bottom of the roasting pan.,Cover the pan and roast in the preheated oven until the internal temperature of the thickest part of the thigh measures 180 degrees F (82 degrees C) with an instant-read thermometer, 3 to 3 1/2 hours.,Remove turkey from the oven, and allow to stand for about 30 minutes before carving.,Serve hot and enjoy!",,,"1 (12 pound) whole turkey, neck and giblets removed,¾ cup olive oil,2 tablespoons garlic powder,2 teaspoons dried basil,1 teaspoon ground sage,1 teaspoon salt,½ teaspoon black pepper",15 mins,,,16,"
Sometimes the best seasoning for turkey is a simple mixture of savory herbs and spices. This easy recipe for herb-roasted turkey requires very little prep time so you can work on the other parts of your holiday meal while your bird is roasting in the oven to tender, juicy perfection.","
Easy Herb-Roasted Turkey",3 hrs 45 mins,
,,2 hrs 5 mins,"Gather all ingredients.,Preheat the oven to 300 degrees F (150 degrees C). Make several small slits in top of pork roast; place into a roasting pan.,Melt butter in a skillet over medium heat. Add garlic, oregano, cayenne, thyme, mustard powder, and black pepper; cook and stir until fragrant, about 1 minute. Remove from the heat.,Spread spice mixture all over pork and rub into slits. Place onion, carrots, and celery around pork; season with salt and pepper.,Roast in the preheated oven for 1 hour 45 minutes. Increase the heat to 425 degrees F (220 degrees C) and continue cooking until pork is browned and an instant-read meat thermometer inserted into the center of the roast reads at least 150 degrees F (65 degrees C), about 15 minutes.,Remove from the oven and let stand for 10 minutes. Recheck the temperature; it should be at least 160 degrees F (75 degrees C) before slicing.,While the pork is resting, place the roasting pan with vegetables and pan drippings over a stove burner set to medium heat. Whisk in flour and simmer to remove raw taste, about 3 minutes. Whisk in stock, a little at a time, until gravy is thickened.,Strain and serve with pork.",,"




","1 (3 pound) boneless pork loin roast,2 tablespoons butter,2 cloves garlic, minced,1 teaspoon dried oregano,½ teaspoon cayenne pepper,½ teaspoon dried thyme,½ teaspoon dry mustard powder,½ teaspoon ground black pepper,1 large onion, diced,2 medium carrots, diced,1 stalk celery, diced,salt and ground black pepper to taste,3 tablespoons flour,½ cup pork stock",25 mins,,"
Substitute chicken stock for pork stock if desired.",12,"
Flavorful pork gravy made with pan drippings, oven-roasted vegetables, and stock served over juicy, tender slices of pork loin. Great to serve to guests! My mother-in-law (who can't cook) demanded I teach her how to make this.","
Roasted Loin of Pork with Pan Gravy",2 hrs 40 mins,
,,45 mins,"Preheat the oven to 325 degrees F (163 degrees C). Line the bottoms of three 9-inch cake pans with parchment paper. Grease the sides with cooking spray.,Make cake: Sift together flours, cocoa powder, baking soda, and salt in a medium bowl. Set aside.,Microwave buttermilk just until warm, about 30 seconds. Stir in vanilla. Set aside.,Beat together brown sugar and butter in a large bowl with an electric mixer until light and fluffy, about 5 minutes. Add eggs one at a time, mixing thoroughly after each addition. Blend in flour mixture and buttermilk in 3 additions until fully combined. Let the mixer run on low speed for 5 minutes, then divide batter evenly between the prepared cake pans.,Bake in the preheated oven until a toothpick inserted into the center of cakes comes out clean, 30 to 35 minutes. Cool cakes in the pans for 15 minutes, then invert onto wire racks to cool completely, at least 30 minutes. Cover cakes with plastic wrap and chill in the refrigerator, 1 hour to overnight.,Meanwhile, make frosting: Combine sugar, milk, flour, and salt in a medium saucepan. Cook over medium heat, whisking constantly, until mixture thickens and begins to simmer, about 10 minutes. Pour into a medium bowl and chill in the refrigerator for about 45 minutes, stirring occasionally.,Beat butter in a large bowl with an electric mixer until smooth, about 5 minutes. Slowly add chilled milk-flour mixture, 1/4 cup at a time, beating well after each addition and scraping down the sides of the bowl. Mix in vanilla.,Assemble cake: Level cake layers evenly using a serrated knife. Spread about 2/3 cup frosting onto a cake layer; repeat with second and third cake layers, stacking layers as you frost. Cover the outside of cake with a thin coat of frosting to catch any crumbs, then place in the refrigerator to chill for about 20 minutes.,Spread remaining frosting over cake. Cut and serve.",,"




","cooking spray,1 ½ cups all-purpose flour,1 ½ cups cake flour,½ cup cocoa powder,1 ½ teaspoons baking soda,½ teaspoon kosher salt,1 ½ cups buttermilk,2 teaspoons vanilla extract,3 ¾ cups brown sugar,1 ½ sticks unsalted butter, softened,3 large eggs, at room temperature,1 cup white sugar,1 cup whole milk,½ cup all-purpose flour, sifted,½ teaspoon salt,2 cups unsalted butter, softened,1 ½ teaspoons vanilla extract",50 mins,,,16,"
This red velvet cake without food coloring features chocolate cake tinted red from the acid in cocoa powder. Nowadays, most cocoa powders are alkalized, as in stripped of acid. Look for a non-alkalized one for this old-fashioned recipe. Completing the classic look is a coat of bright white ermine frosting, cooked the old-fashioned way.","
The Real Red Velvet Cake",4 hrs 25 mins,"1 (3-layer, 9-inch) cake"
,,1 hr 40 mins,"Trim excess fat and thin membrane from leg of lamb; place into roasting pan. Cut slits in the meat and insert garlic slivers into slits. Mix olive oil, lemon juice, and rosemary in a small bowl; brush mixture over lamb. Lay bacon slices onto the meat. Let roast stand at room temperature for 30 minutes.,Preheat oven to 325 degrees F (165 degrees C).,Roast lamb in the preheated oven until an instant-read meat thermometer inserted into the thickest part of the leg, not touching bone, reads 145 degrees F (65 degrees C) for medium-rare or 160 degrees F (70 degrees C) for medium, 1 1/2 to 1 3/4 hours. Transfer lamb to a serving platter, cover loosely with aluminum foil, and let stand while you make the sauce.,Skim and discard excess grease from pan drippings left in roasting pan; place roasting pan over medium heat. Cook and stir onion in drippings until translucent, about 5 minutes; pour in wine. Stir wine and pan drippings, scraping up and dissolving brown bits of food stuck on the bottom of the pan. Pour in stock, bring sauce to a boil, and reduce heat to low. Stir tomato paste into sauce, bring to a simmer, and cook until sauce has reduced to about 1 cup. Season with salt and black pepper. For a smoother sauce, strain before serving.",,"




","1 (4 pound) leg of lamb,3 cloves garlic, slivered,2 tablespoons olive oil,1 tablespoon lemon juice,1 teaspoon minced fresh rosemary,6 slices bacon,1 small onion, minced,½ cup dry red wine,1 cup beef stock,1 teaspoon tomato paste,salt and ground black pepper to taste",20 mins,,,6,"
A family favorite for over two decades! Growing up, Mom would always make this for dinner on Easter Sunday or New Year's Day. The bacon adds a wonderful smoky flavor to the outside of the lamb, and the garlic permeates the meat throughout. All topped off with a delectable red wine reduction. Delicious served with mashed potatoes!","
Bacon-Wrapped Leg of Lamb with Red Wine Reduction",2 hrs 30 mins,1 leg of lamb
,,1 hr 25 mins,"Gather all ingredients.,Melt butter in a large soup pot over medium-high heat. Sauté mushrooms and 1 pinch salt in the melted butter until mushrooms release their juices, 5 to 10 minutes. Reduce heat to medium-low and continue to cook, stirring often, until juices evaporate and mushrooms are caramelized, 15 to 25 minutes. Set aside a few attractive mushroom slices for garnish later, if desired.,Add onion to the mushrooms; cook until onion is soft and translucent, about 5 minutes.,Stir flour into the mushroom mixture and cook, stirring often, to remove the raw flour taste, about 2 minutes.,Add thyme bundle and garlic cloves, then pour in 4 cups chicken broth and 1 cup water. Reduce heat to low and simmer for 1 hour. Remove and discard thyme bundle.,Purée soup with a blender in batches until smooth and thick.,Stir in cream. If too thick, add a little chicken broth or water. Season with salt and black pepper.,Ladle into bowls, and garnish with reserved mushroom slices and thyme leaves.",,,"¼ cup unsalted butter,2 (16 ounce) packages sliced fresh mushrooms,1 pinch salt,1 medium yellow onion, diced,1 ½ tablespoons all-purpose flour,6 sprigs fresh thyme, tied in a bundle with kitchen twine,2 cloves garlic, peeled,4 cups chicken broth, or more to taste,1 cup water, or more to taste,1 cup heavy whipping cream,1 salt and freshly ground black pepper to taste,1 teaspoon fresh thyme leaves for garnish, or to taste",10 mins,,"
Prep time assumes you are using pre-sliced mushrooms. If not, your prep time will be longer.You can also use an immersion stick blender to purée the soup.",6,"
This mushroom soup is creamy and rich — it's one of my favorite soups of all time and it's so easy! The long, slow caramelization of the mushrooms requires a little patience, but it really unlocks their magical flavor, which is the secret to this mushroom soup.","
Chef John's Creamy Mushroom Soup",1 hr 35 mins,
,,35 mins,"Preheat the oven to 350 degrees F (175 degrees C).,Fill a large pot with lightly salted water and bring to a rapid boil. Cook egg noodles at a boil until tender yet firm to the bite, 7 to 9 minutes.,While the noodles are cooking, heat oil in a medium saucepan over medium heat. Sauté onion and bell peppers in the hot oil until tender, 5 to 7 minutes.,Pour condensed soup into the saucepan. Add tuna, milk, salt, and pepper; mix until well combined. Reduce heat to medium-low.,Drain egg noodles well. Fold noodles into the tuna mixture until well coated. Transfer to a 2-quart casserole and sprinkle bread crumbs over top.,Bake in the preheated oven until the top is crisp and golden brown, 20 to 30 minutes.",,"




","1 (12 ounce) package egg noodles,2 tablespoons vegetable oil,¼ cup chopped onion,¼ cup chopped green bell pepper,¼ cup chopped red bell pepper,1 (10.5 ounce) can condensed cream of Cheddar cheese soup,1 (5 ounce) can tuna, drained,¼ cup milk,¼ teaspoon salt,ground black pepper to taste,¼ cup Italian seasoned bread crumbs",20 mins,,,6,"
This tuna noodle casserole recipe with cheese was a favorite in my home growing up and now it's a favorite of my family as well. I double the recipe these days for my husband and three children.","
Cheesy Tuna Noodle Casserole",55 mins,1 2-quart casserole
,,1 hr,"Preheat the oven to 425 degrees F (220 degrees C).,Stir butter, thyme, rosemary, parsley, garlic powder, cayenne pepper, salt, and black pepper in a small bowl. Set herb butter aside.,Place potatoes, onions, and garlic on a baking sheet. Drizzle with olive oil; season with salt and pepper.,Pat dry turkey thighs with a paper towel; season with salt and pepper. Lay turkey thighs over vegetables on the baking sheet. Rub herb butter under turkey skin and over meat. Top with lemon zest and juice.,Bake in the preheated oven for 30 minutes. Baste turkey with sheet juices and continue baking, basting turkey every 15 minutes, until thighs are no longer pink in the centers, about 30 minutes more. An instant-read thermometer inserted near the bone should read at least 165 degrees F (74 degrees C).",,"




","½ cup salted butter, at room temperature,2 teaspoons dried thyme,2 teaspoons dried rosemary,2 teaspoons dried parsley,2 teaspoons garlic powder,1 teaspoon cayenne pepper,salt and ground black pepper to taste,1 pound baby potatoes,2 large onions, roughly chopped,8 cloves garlic, minced,2 tablespoons olive oil,4 turkey thighs,1 medium lemon, zested and juiced",15 mins,,,4,"
Turkey thighs are the way to go if you are having a smaller Thanksgiving this year.","
Roasted Turkey Thighs",1 hr 15 mins,
,,20 mins,"Preheat the oven to 350 degrees F (175 degrees C). Grease and flour an 11x17-inch baking pan with 1-inch high sides.,Prepare the cake: Beat sugar and butter together in a large bowl with an electric mixer on medium speed until light and fluffy. Beat eggs one at a time into the butter mixture; beat in sour cream and vanilla.,Sift flour, baking powder, baking soda, and salt together in a bowl. With the mixer at low speed, add flour mixture to butter mixture alternately with milk just until combined. Scrape the sides and bottom of the bowl and finish mixing with a rubber spatula. Pour batter into the prepared pan; spread to corners of the pan and smooth the top with a spatula.,Bake in the preheated oven until a toothpick inserted near the center comes out clean, about 20 minutes. Cool cake completely, about 30 minutes. To remove cake from the pan, run a paring knife between cake and the pan. Cover cake pan with a plate or cooling rack; invert to transfer cake onto a plate.,Make the frosting: Beat cream cheese, sugar, and vanilla together in a bowl with an electric mixer on medium speed until fluffy, about 2 minutes. Reduce mixer speed to low; slowly pour in cream. Once cream is incorporated, turn mixer speed to medium-high; beat until stiff peaks form, about 2 minutes.,Spread cream cheese mixture evenly over top and sides of cake, smoothing the top.,Finish with decoration: Place 2 to 3 rows of overlapping strawberry slices parallel to the short sides of the cake for the two red stripes of the Canadian flag. Trace out a maple leaf shape in the center of the cake with a toothpick. Use points of strawberry slices to create points of the maple leaf. Cut a strip of strawberry for the leaf stem. Fill in the area of the maple leaf with sliced strawberries.,Refrigerate cake until ready to serve.",,"




","1 ½ cups white sugar,1 cup butter, softened,3 large eggs, at room temperature,½ cup sour cream, at room temperature,2 teaspoons vanilla extract,2 ½ cups all-purpose flour,2 teaspoons baking powder,1 teaspoon baking soda,1 pinch salt,1 cup milk, at room temperature,1 (8 ounce) package cream cheese, softened,½ cup white sugar,1 teaspoon vanilla extract,2 cups heavy whipping cream,2 cups sliced fresh strawberries",45 mins,,,24,"
Celebrate Canada Day with a Canadian flag cake! Vanilla sheet cake is topped with a whipped cream cheese frosting and decorated with strawberries to make the flag of Canada. This will feed a crowd. Serve it with extra sliced strawberries if desired.","
Canadian Flag Cake",1 hr 35 mins,1 11x17-inch cake
,,40 mins,"Preheat the air fryer to 350 degrees F (175 degrees C).,Place rosemary, chives, garlic, salt, and pepper onto a cutting board. Cut butter into thin slices on top of herbs and seasonings and mash until well blended.,Pat turkey breast dry and rub with herbed butter on both sides and under the skin.,Place turkey into the air fryer basket, skin-side down, and air fry for 20 minutes.,Turn turkey to skin-side up carefully and continue frying until an instant-read thermometer inserted near the bone reads 165 degrees F (74 degrees C), about 18 minutes more. Transfer to a platter and tent with aluminum foil; allow to rest for 10 minutes. Slice and serve warm.",,"




","1 tablespoon finely chopped fresh rosemary,1 teaspoon finely chopped fresh chives,1 teaspoon finely minced fresh garlic,½ teaspoon salt, or to taste,¼ teaspoon ground black pepper, or to taste,2 tablespoons cold unsalted butter,2 ¾ pounds skin-on, bone-in split turkey breast",10 mins,,"
Use any combination of fresh herbs that you and your family will enjoy!",6,"
This air fryer turkey breast has all the flavor of a roasted turkey, but in much less time, and with much less fuss! So if you don't want the time or the hassle of a full bird, try a split turkey breast, prepared in the air fryer. ","
Air Fryer Turkey Breast",1 hr,
,,20 mins,"Preheat the oven to 400 degrees F (200 degrees C).,Place ground beef, onion, bread crumbs, milk, Parmesan cheese, Worcestershire sauce, Italian seasoning, oregano, red pepper flakes, salt, garlic salt, and hot pepper sauce into a large bowl; mix until evenly combined.,Shape the mixture into 12 meatballs and place onto a baking sheet.,Bake in the preheated oven until no longer pink in the center, 20 to 25 minutes.,Serve over pasta.",,,"1 pound extra lean ground beef,1 small onion, diced,½ cup seasoned bread crumbs,⅓ cup skim milk,¼ cup grated Parmesan cheese,1 ½ tablespoons Worcestershire sauce,1 ½ teaspoons Italian seasoning,¾ teaspoon dried oregano,¾ teaspoon crushed red pepper flakes,½ teaspoon sea salt,½ teaspoon garlic salt,1 dash hot pepper sauce (such as Frank's RedHot®), or to taste",20 mins,,,4,"
This beef meatball recipe is a compilation of many, many meatball recipes to finally achieve what I was looking for... Meatball Nirvana! Cover with your favorite red sauce and serve with pasta or in crusty garlic bread rolls.","
Meatball Nirvana",40 mins,12 meatballs
,,25 mins,"Preheat the oven to 350 degrees F (175 degrees C). Place 24 paper baking cups in two (12-cup) muffin pans. Set aside.,Beat butter and cream cheese with a stand mixer fitted with the paddle attachment at medium speed until creamy, about 1 minute. Gradually add sugar and beat until light and fluffy, 2 to 3 minutes. Add eggs, 1 at a time, beating just until blended after each addition. Beat in vanilla, lemon juice, and lemon zest.,Whisk together flour, baking powder, baking soda, and salt in a bowl. Gradually add flour mixture to butter mixture alternately with sour cream on low speed, beating just until blended after each addition, beginning and ending with flour mixture. Gently fold in blueberries. Spoon or scoop batter into prepared baking cups, filling each about 2/3 full (about 1/4 cup batter for each).,Bake in the preheated oven until a wooden pick inserted in the centers comes out clean, 22 to 25 minutes. Cool in pans on wire racks for 5 minutes. Remove from pans to wire racks and cool completely, about 30 minutes.,For the frosting beat cream cheese and butter with a stand mixer fitted with the paddle attachment at medium speed until light and fluffy, about 2 minutes. Reduce speed to low and gradually add powdered sugar and beat well. Beat in zest and 1 teaspoon lemon juice. Increase speed to medium-high and beat until light and fluffy, adding 1 teaspoon lemon juice if needed to reach desired consistency. Pipe or spread frosting onto cupcakes.",,"




","½ cup salted butter, softened,½ (8 ounce) package cream cheese, softened,2 cups white sugar,4 large eggs, at room temperature,2 teaspoons vanilla extract,1 tablespoon lemon juice,2 teaspoons lemon zest,3 cups all-purpose flour,1 teaspoon baking powder,½ teaspoon baking soda,½ teaspoon salt,1 (8 ounce) carton sour cream,1 ½ cups fresh blueberries,1 (8 ounce) package cream cheese, softened,½ cup salted butter, softened,1 (16 ounce) box powdered sugar,1 teaspoon lemon zest,1 teaspoon lemon juice, or more as needed",25 mins,,,24,"
These blueberry cupcakes are super tender with just a slight tang from the cream cheese, sour cream, and lemon juice. These are perfect for a special occasion! Birthday parties, brunch, or picnics. Garnish with extra fresh blueberries and lemon zest for a lovely presentation.","
Blueberry Cupcakes with Lemon Cream Cheese Frosting",1 hr 25 mins,24 cupcakes
