additional_time,cook_time,directions_steps,image,image_url,ingredients_list,nutrition_facts,prep_time,recipe_details_list,servings,title,total_time,yield_result
,,"Combine watermelon, tomatoes, red pepper, cucumber, shallot, lime juice, vinegar, salt, and pepper in a high-powered blender. Blend until smooth, 20 to 30 seconds. Refrigerate for at least 1 hour to allow flavors to meld and soup to chill.,Stir gazpacho before serving, as it has a tendency to separate, and divide between 4 bowls. Top with feta cheese and cilantro.",,https://www.allrecipes.com/thmb/UDvoVCMEkznPJV0ceIXOS9qEfl8=/1500x0/filters:no_upscale():max_bytes(150000):strip_icc()/1655066550IMG_2077202-2000-d06cb8278ad145d7bd0bb45ddf09901a.jpg,"4 cups cubed seeded watermelon,2 roma (plum) tomatoes, seeded and chopped,1 red bell pepper, chopped,½ English (seedless) cucumber - peeled, seeded, and cubed,2 tablespoons minced shallot,2 tablespoons fresh lime juice,1 tablespoon apple cider vinegar,1 ½ teaspoons salt, or to taste,¼ teaspoon freshly ground black pepper,2 tablespoons crumbled feta cheese,2 tablespoons minced fresh cilantro","[{'83': 'Calories'}, {'1g': 'Fat'}, {'17g': 'Carbs'}, {'3g': 'Protein'}]",,,,Summer Watermelon Gazpacho,,
,,"Gather the ingredients.,Make the patties: Mix ground sirloin, panko bread crumbs, egg, milk, 1/2 packet onion soup mix, Worcestershire sauce, and black pepper together in a large bowl; shape into 5 patties.,Heat a skillet over medium heat. Cook patties in the hot skillet until browned, 3 to 5 minutes per side.,Make the gravy: Melt butter in a separate skillet over medium-high heat. Sauté mushrooms and onion in melted butter until tender, about 5 minutes. Stir flour and remaining 1/2 packet onion soup mix into mushroom mixture until combined.,Gradually add beef stock and water, stirring continually, until simmering. Reduce heat to medium; cook, stirring frequently, until gravy has thickened, about 4 to 5 minutes. Season with salt and pepper.,Place browned patties into gravy; simmer until very tender, about 30 minutes. An instant-read thermometer inserted into the center should read 160 degrees F (70 degrees C).",,https://www.allrecipes.com/thmb/z-H16a07AqRZjAmTM5Ko4zrAmKg=/1500x0/filters:no_upscale():max_bytes(150000):strip_icc()/2067307-3814bac5191a42caad0e604d01f78ffa.jpg,"1 pound ground sirloin,½ cup panko bread crumbs,1 egg, beaten,2 tablespoons milk,½ (1 ounce) package dry onion soup mix,1 teaspoon Worcestershire sauce,¼ teaspoon ground black pepper,3 tablespoons butter,2 cups fresh mushrooms, sliced,1 sweet onion, sliced,3 tablespoons all-purpose flour,½ (1 ounce) package dry onion soup mix,1 ½ cups beef stock,1 cup water,salt and ground black pepper to taste","[{'421': 'Calories'}, {'20g': 'Fat'}, {'27g': 'Carbs'}, {'33g': 'Protein'}]",,,,Midwest Salisbury Steak,,
,,"Whisk garlic, rice vinegar, soy sauce, fish sauce, brown sugar, Sriracha, hoisin, and sesame oil together in a mixing bowl for the dressing.,Tear chicken apart into strands similar in width to the spaghetti. Refrigerate until ready to use.,Bring a large pot of lightly salted water to a boil. Cook spaghetti in the boiling water, stirring occasionally, until tender yet firm to the bite, about 12 minutes. Drain and rinse with cold water.,Transfer spaghetti to a mixing bowl; add the chicken, carrots, bell pepper, and green onions. Pour in the dressing and toss by hand until well combined. Seal the surface of the salad with plastic wrap and refrigerate, tossing occasionally, for 2 to 12 hours, the longer the better.,Add peanuts, basil, mint, and cilantro to the salad. Toss well; taste and adjust for seasoning.",,,"3 cloves garlic, crushed,½ cup seasoned rice vinegar,1 tablespoon soy sauce,1 tablespoon fish sauce,1 tablespoon brown sugar,1 tablespoon Sriracha chile sauce,1 tablespoon hoisin sauce,1 teaspoon sesame oil,1 cooked chicken breast,1 (8 ounce) package spaghetti,1 cup grated carrots,1 red bell pepper, thinly sliced,4 green onions, thinly sliced,½ cup chopped roasted, salted peanuts,⅓ cup chopped fresh basil,⅓ cup chopped fresh mint,⅓ cup chopped cilantro","[{'441': 'Calories'}, {'12g': 'Fat'}, {'65g': 'Carbs'}, {'20g': 'Protein'}]",,,,Chicken Noodle Salad,,
,,"Combine olive oil, maple seasoning, and lemon juice in a glass bowl. Add shrimp and toss to coat. Refrigerate until ready to grill.,Whisk olive oil, honey, lime juice, cilantro, balsamic vinegar, salt, and pepper together in a small bowl. Set vinaigrette aside.,Preheat an indoor or outdoor grill to medium-high heat. Thread the shrimp onto skewers. Grill until shrimp turn pink and opaque, about 2 minutes per side. Remove from skewers and set aside.,Place mixed greens in the bottom of a large salad bowl. Lay cucumber, corn, tomato, red onion, and avocado in sections on top of the greens. Pile the grilled shrimp in the center of the salad. Drizzle with the vinaigrette and toss to coat. Serve immediately.",,https://www.allrecipes.com/thmb/mCjztmbnCfV5mx5TEBwwhvgTCiY=/1500x0/filters:no_upscale():max_bytes(150000):strip_icc()/8280951-260be9ac29454c369718300847df714e.jpg,"1 tablespoon olive oil,2 ¼ teaspoons smokehouse maple seasoning (such as McCormick Grill Mates),1 ½ teaspoons lemon juice,12 ounces peeled and deveined shrimp,¼ cup extra-virgin olive oil,2 tablespoons honey,2 tablespoons fresh lime juice,2 tablespoons chopped cilantro,1 tablespoon balsamic vinegar,salt and ground black pepper to taste,4 cups mixed salad greens, or more to taste,½ cup thinly sliced English cucumber,⅓ cup freshly cooked corn,½ cup diced tomato,¼ cup sliced red onion,1 avocado, diced","[{'746': 'Calories'}, {'52g': 'Fat'}, {'49g': 'Carbs'}, {'33g': 'Protein'}]",,,,Summer Grilled Shrimp Salad,,
,,"Place egg in a saucepan and cover with cold water. Bring water to a boil and immediately remove from heat. Cover and let eggs stand in hot water for 10 to 12 minutes. Remove from hot water, cool and peel. For faster cooling, place the eggs in an ice bath before peeling.,In a medium bowl, stir together the mayonnaise, Dijon mustard, yellow mustard, lemon juice and green onions. Chop the eggs into big chunks and mix gently with the dressing. Season with salt and pepper.",,https://www.allrecipes.com/thmb/5P2xjjoAMINJ4rYN6VemqAALi8s=/1500x0/filters:no_upscale():max_bytes(150000):strip_icc()/804307-e638e34a16bf45fe957aebf5173e1860.jpg,"6 eggs,¼ cup mayonnaise,1 teaspoon Dijon mustard,½ teaspoon prepared yellow mustard,½ lemon, juiced,¼ cup chopped green onions,salt and pepper to taste","[{'212': 'Calories'}, {'18g': 'Fat'}, {'3g': 'Carbs'}, {'10g': 'Protein'}]",,,,Jen's Heavenly Egg Salad,,
,,"In a medium bowl, whip cream to soft peaks.,Combine meat, celery, grapes, almonds, parsley, salt, and mayonnaise with whipped cream. Chill.",,,"2 ½ cups diced and chilled, cooked chicken meat,1 cup chopped celery,1 cup sliced, seedless grapes,½ cup sliced almonds,2 tablespoons chopped fresh parsley,1 teaspoon salt,1 cup mayonnaise,¼ cup heavy whipping cream","[{'274': 'Calories'}, {'24g': 'Fat'}, {'5g': 'Carbs'}, {'11g': 'Protein'}]",,,,Becky's Chicken Salad,,
,,"Gather all ingredients. Preheat the oven to 350 degrees F (175 degrees C). Grease and flour two 9-inch cake pans.,To make the cake: Sift flour, sugar, baking soda, and salt together in a large bowl. Combine bananas, oil, walnuts, pineapple, and eggs in another large bowl; mix well.,Stir flour mixture into banana mixture until combined. Pour batter into the prepared pans.,Bake in the preheated oven until a toothpick inserted into the center of each pan comes out clean, about 1 hour. Allow cakes to cool on wire racks.,Meanwhile, make frosting: Beat together confectioners' sugar, cream cheese, butter, and vanilla in a medium bowl until smooth.,Evenly spread frosting on the middle, sides, and top of cooled cake.",,,"3 cups all-purpose flour,2 cups white sugar,1 teaspoon baking soda,1 teaspoon salt,2 cups mashed bananas,1 ½ cups canola oil,1 cup chopped black walnuts,1 (8 ounce) can crushed pineapple, drained,3 large eggs,1 pound confectioners' sugar,1 (8 ounce) package cream cheese, softened,¼ pound butter, softened,1 teaspoon vanilla extract","[{'719': 'Calories'}, {'40g': 'Fat'}, {'86g': 'Carbs'}, {'7g': 'Protein'}]",,,,Hummingbird Cake,,
,,"Preheat the oven to 400 degrees F (200 degrees C).,Stir together butter, mustard, and honey in a small bowl. Set aside.,Mix together bread crumbs, pecans, and parsley in another bowl.,Brush each salmon fillet lightly with honey mustard mixture.,Sprinkle the tops of fillets with bread crumb mixture.,Bake salmon in the preheated oven until it flakes easily with a fork, 12 to 15 minutes. Season with salt and pepper, and garnish with a wedge of lemon.",,,"¼ cup butter, melted,3 tablespoons Dijon mustard,1 ½ tablespoons honey,¼ cup dry bread crumbs,¼ cup finely chopped pecans,4 teaspoons chopped fresh parsley,4 (4 ounce) fillets salmon,salt and pepper to taste,1 lemon, for garnish","[{'422': 'Calories'}, {'29g': 'Fat'}, {'18g': 'Carbs'}, {'24g': 'Protein'}]",,,,Baked Dijon Salmon,,
,,"Rinse whole lettuce leaves and pat dry, being careful not to tear them; set aside.,Heat oil in a large skillet over medium-high heat. Add beef; cook and stir until browned and crumbly, 5 to 7 minutes. Drain and discard grease; transfer beef to a bowl. Add onion to the same skillet; cook and stir until just tender, 5 to 7 minutes.,Stir in hoisin sauce, garlic, soy sauce, vinegar, ginger, and chile pepper sauce until well combined. Add water chestnuts, green onions, sesame oil, and cooked beef; cook and stir until the onions just begin to wilt, about 2 minutes.,Arrange lettuce leaves around the outer edge of a large serving platter; spoon beef mixture in the center.",,,"16 Boston Bibb or butter lettuce leaves,1 pound lean ground beef,1 tablespoon cooking oil,1 large onion, chopped,¼ cup hoisin sauce,2 cloves fresh garlic, minced,1 tablespoon soy sauce,1 tablespoon rice wine vinegar,2 teaspoons minced pickled ginger,1 dash Asian chile pepper sauce, or to taste (Optional),1 (8 ounce) can water chestnuts, drained and finely chopped,1 bunch green onions, chopped,2 teaspoons Asian (dark) sesame oil","[{'388': 'Calories'}, {'22g': 'Fat'}, {'24g': 'Carbs'}, {'23g': 'Protein'}]",,,,Asian Lettuce Wraps,,
,,"Whisk buttermilk, mayonnaise, shallot, dill, lemon juice, and salt together in a bowl until dressing is smooth; refrigerate.,Mix lettuce, bacon, avocado, eggs, and salmon together in a bowl. Add dressing and toss until coated; season with black pepper.",,https://www.allrecipes.com/thmb/OtvWYrPDvrzyUWu8IQVftD0riKE=/1500x0/filters:no_upscale():max_bytes(150000):strip_icc()/258277-salmon-cobb-salad-magazine-4x3-43c651aa647e4ce788afc4222119032e.jpg,"¾ cup buttermilk,½ cup mayonnaise,¼ cup minced shallot,3 tablespoons chopped fresh dill,1 tablespoon lemon juice,½ teaspoon salt,1 head Bibb lettuce, leaves separated,8 ounces cooked bacon, cut into pieces,1 avocado, cut into 1/2-inch pieces,3 hard-boiled eggs, quartered and halved,1 (3 ounce) package smoked salmon,ground black pepper to taste","[{'249': 'Calories'}, {'20g': 'Fat'}, {'3g': 'Carbs'}, {'13g': 'Protein'}]",,,,Salmon Cobb Salad,,
,,"Gather all ingredients.,Turn on a multi-functional pressure cooker (such as an Instant Pot) and select Sauté function. Heat oil for 1 minute.,Add onion and 1/2 teaspoon salt to pot; cook and stir until onion begins to soften, 3 to 4 minutes.,Sprinkle beef with 1 teaspoon salt and the pepper. Add to the pot. Cook and stir until beef is evenly browned, about 2 minutes.,Add garlic and thyme; cook until fragrant, about 30 seconds.,Pour in soy sauce. Stir mushrooms into the pot. Stir in flour until incorporated. Stir in chicken broth and remaining 1/2 teaspoon salt.,Close and lock the lid. Set to high pressure according to manufacturer's instructions for 10 minutes. Allow 10 to 15 minutes for pressure to build.,Release pressure carefully using the quick-release method.,Open pot; stir in egg noodles. Close and lock the lid. Set to high pressure according to manufacturer's instructions for 5 minutes.,Release pressure naturally for 5 minutes according to manufacturer's instruction. Release remaining pressure using the quick-release method. Open pressure cooker; stir in sour cream.,Serve and enjoy!",,,"2 tablespoons canola oil,½ onion, diced,2 teaspoons salt, divided,2 pounds beef stew meat, cut into 1-inch cubes,1 teaspoon freshly ground black pepper,3 cloves garlic, minced,½ teaspoon dried thyme,2 tablespoons soy sauce,3 cups chopped mushrooms,2 tablespoons all-purpose flour,3 cups chicken broth,1 (16 ounce) package wide egg noodles,¾ cup sour cream, or to taste","[{'536': 'Calories'}, {'26g': 'Fat'}, {'45g': 'Carbs'}, {'29g': 'Protein'}]",,,,Beef Stroganoff for Instant Pot,,
,,"Cook ground beef and onion in a large skillet over medium-high heat until beef is browned and crumbly and onion is translucent, 5 to 7 minutes. Drain excess grease.,Reduce the heat to medium. Stir in ketchup, vinegar, brown sugar, mustard, salt, and pepper; simmer for about 15 minutes.,Spoon beef mixture onto buns to serve.",,https://www.allrecipes.com/thmb/Yk3wBVKW4lrEOig94XAxzckzl_Q=/1500x0/filters:no_upscale():max_bytes(150000):strip_icc()/92763PennsylvaniaCoalRegionBarbecueMyHotSouthernMess4x3-90148be6146b4a34a5e20476be7ba9fb.jpg,"1 pound ground beef,1 medium onion, chopped,¾ cup ketchup,1 ½ tablespoons white vinegar,1 ½ tablespoons brown sugar,1 ½ teaspoons prepared yellow mustard,salt and pepper to taste,4 hamburger buns","[{'214': 'Calories'}, {'15g': 'Fat'}, {'10g': 'Carbs'}, {'10g': 'Protein'}]",,,,Pennsylvania Coal Region Barbecue,,
,,"Gather all ingredients. Preheat the oven to 300 degrees F (150 degrees C).,Gently mix the flour, baking powder, baking soda, and salt with a fork in a bowl. Set aside.,Beat the butter, brown sugar, and white sugar with an electric mixer in a large bowl until smooth. Add the eggs one at a time, allowing each egg to blend into the butter mixture before adding the next. Beat in the vanilla with the last egg.,Mix in the flour mixture until just incorporated. Fold in the chocolate chips, mixing just enough to evenly combine.,Divide the dough into 24 3-tablespoon-sized balls. Flatten the balls to about 1/4-inch thick onto a baking sheet.,Bake in the preheated oven until the edges are golden, 15 to 17 minutes. Allow the cookies to cool on the baking sheet until the centers begin to set, about 20 minutes.",,https://www.allrecipes.com/thmb/eUoZXQu7EVRrjKSpr3rF9wv5bpY=/1500x0/filters:no_upscale():max_bytes(150000):strip_icc()/ALR-178151-felix-ks-dont-even-try-to-say-these-arent-the-best-youve-ever-eaten-because-they-are-chocolate-chip-cookies-VAT-4x3-d77f62c3a2d74e979f788a86ba9bec36.jpg,"3 ½ cups all-purpose flour,1 teaspoon baking powder,1 teaspoon baking soda,1 teaspoon salt,1 cup butter, softened,2 cups brown sugar,6 tablespoons white sugar,2 eggs,4 teaspoons vanilla extract,1 (12 ounce) bag chocolate chips","[{'267': 'Calories'}, {'13g': 'Fat'}, {'38g': 'Carbs'}, {'3g': 'Protein'}]",,,,"Felix K.'s 'Don't even try to say these aren't the best you've ever eaten, because they are' Chocolate Chip Cookies",,
,,"Cook pasta as directed on package, adding broccoli to the boiling water for the last 2 minutes of the pasta cooking time. Drain pasta mixture.,Meanwhile, heat dressing in large nonstick skillet on medium-high heat. Add chicken and cook until no longer pink in the center, stirring occasionally, about 5 to 7 minutes.,Stir in milk, cream cheese, Parmesan cheese, and basil. Bring to a boil, stirring constantly. Cook until sauce is well blended and heated through, about 1 to 2 minutes.,Add chicken mixture to pasta mixture; mix lightly.",,https://www.allrecipes.com/thmb/zZqEslmLznOTHeSg1KhtbhUgQRs=/1500x0/filters:no_upscale():max_bytes(150000):strip_icc()/1421993-easy-chicken-and-broccoli-alfredo-Breanna-Dean-4x3-1-ca264a6d14be41fa8bccec3edf4bbc5e.jpg,"8 ounces fettuccine, uncooked,2 cups fresh broccoli florets,¼ cup Kraft Zesty Italian Dressing,1 pound boneless skinless chicken breasts, cut into bite-sized pieces,1 ⅔ cups milk,4 ounces Philadelphia Cream Cheese, cubed,¼ cup Kraft Grated Parmesan Cheese,½ teaspoon dried basil leaves","[{'511': 'Calories'}, {'21g': 'Fat'}, {'32g': 'Carbs'}, {'47g': 'Protein'}]",,,,Easy Chicken and Broccoli Alfredo,,
,,"In a medium bowl, mix together the ground beef, egg, cracker crumbs, onion, salt, pepper and poultry seasoning using your hands. Shape into 6 patties about 1 inch thick.,Fry the patties in a large skillet over medium-high heat for 3 to 4 minutes per side, or until browned. Drain off grease, and remove patties to a platter; keep warm.,Melt the butter in the same skillet, and add the mushrooms. Cook and stir for about 2 minutes. Sprinkle the flour over, and mix in until blended. Stir in the milk and beef bouillon. Cook and stir over medium heat until smooth and starting to thicken. Return the patties to the gravy and cook over low heat, uncovered, for 10 minutes, stirring occasionally.",,,"1 pound ground beef,1 egg,3 tablespoons crushed buttery round cracker crumbs,2 tablespoons finely chopped onion,½ teaspoon salt,½ teaspoon pepper,¼ teaspoon poultry seasoning,2 (4 ounce) cans sliced mushrooms with juice,3 tablespoons butter,3 tablespoons all-purpose flour,3 cups milk,3 cubes beef bouillon","[{'296': 'Calories'}, {'19g': 'Fat'}, {'13g': 'Carbs'}, {'19g': 'Protein'}]",,,,Scrumptious Salisbury Steak in Mushroom Gravy,,
,,"Combine rhubarb and lemon juice in a large saucepan over medium-low heat; cook, stirring often, for 5 minutes.,Mix 1 cup sugar and cornstarch together in a bowl; stir into rhubarb mixture. Cook and stir until rhubarb mixture is thickened and bubbling, about 5 minutes. Stir in pie filling; remove from heat and cool filling, about 10 minutes.,Preheat oven to 350 degrees F (175 degrees C). Grease a 9x13-inch baking dish.,Combine 3 cups flour, 1 cup sugar, baking powder, baking soda, and salt in a large bowl; cut in 1 cup cubed butter until mixture resembles fine crumbs.,Beat buttermilk, eggs, and vanilla extract together in a separate bowl; add to flour mixture and stir just until batter is moistened.,Spread a little more than half of the batter into the prepared baking dish; top with cherry-rhubarb filling. Drop teaspoonfuls of remaining batter over filling.,Combine 1 1/2 cup sugar and 1 1/2 cups flour in a bowl; cut in 1/2 cup cubed butter until mixture resembles coarse crumbs. Sprinkle mixture over batter.,Bake in the preheated oven until a toothpick inserted in the center comes out clean, 40 to 45 minutes.",,https://www.allrecipes.com/thmb/VmMWPN0MCXSoUQ9GfNx-ilzPFHs=/1500x0/filters:no_upscale():max_bytes(150000):strip_icc()/257395big-rays-cherry-rhubarb-coffee-barsKim-a63a0968850e44afbbc4439d49df5b5c.jpg,"4 cups chopped rhubarb,2 tablespoons lemon juice,1 cup white sugar,⅓ cup cornstarch,1 (20 ounce) can cherry pie filling,3 cups all-purpose flour,1 cup white sugar,1 teaspoon baking powder,1 teaspoon baking soda,½ teaspoon salt,1 cup cold butter, cubed,1 cup buttermilk,2 eggs, lightly beaten,1 teaspoon vanilla extract,1 ½ cups white sugar,1 ½ cups all-purpose flour,½ cup cold butter, cubed","[{'466': 'Calories'}, {'16g': 'Fat'}, {'76g': 'Carbs'}, {'5g': 'Protein'}]",,,,Big Ray's Cherry Rhubarb Coffee Bars,,
,,"Bring a large pot of lightly salted water to a boil. Add pasta and cook for 8 to 10 minutes or until al dente; drain.,Meanwhile, heat oil in a small skillet over medium-low heat. Stir in sesame seeds and cook until golden brown. Remove from heat. Stir in soy sauce, vinegar, and sugar. Pour dressing into a sealable container, and set aside.,In a large bowl, mix together pasta, cooked chicken, and 1 cup dressing (reserve remaining dressing). Cover salad, and refrigerate at least 6 hours.,Directly before serving, stir in parsley, green onions, and spinach. Toss with remaining dressing, if desired.",,https://www.allrecipes.com/thmb/GvXqlARWBDzcRCb4L4BCGrX7A9M=/1500x0/filters:no_upscale():max_bytes(150000):strip_icc()/96736-fe982ee037244e02949c139121375724.jpg,"1 (12 ounce) package radiatore pasta,¼ cup sesame seeds,¼ cup salad oil,¾ cup soy sauce,½ cup white wine vinegar,3 ½ tablespoons sugar,2 cups cubed, cooked chicken,½ cup chopped fresh parsley,½ cup coarsely chopped green onion,4 cups torn fresh spinach leaves","[{'475': 'Calories'}, {'19g': 'Fat'}, {'54g': 'Carbs'}, {'23g': 'Protein'}]",,,,Sesame Chicken Pasta Salad,,
,,"Bring a large pot of lightly salted water to a boil. Add penne pasta and cook for 8 to 10 minutes or until al dente; drain.,Melt butter in a large skillet over medium heat. Add chicken, pepper and salt. Cook 10 minutes or until chicken is cooked through. Remove skillet from heat.,In a bowl, mix together salad dressing, vinegar and cheese. Toss together pasta, chicken, lettuce, and dressing mixture. Place in large serving bowl, and sprinkle with tomato. Garnish with croutons and Parmesan curls, if desired.",,https://www.allrecipes.com/thmb/-7Htxfnk3Md2U_YHHFwTfa9dFTk=/1500x0/filters:no_upscale():max_bytes(150000):strip_icc()/1242096-c31875d9feab4c19863425fd3c5e0aff.jpg,"1 pound dry penne pasta,1 tablespoon butter,6 skinless, boneless chicken breast halves - cut into 1 inch cubes,½ teaspoon ground black pepper,¼ teaspoon salt,1 (8 ounce) bottle Caesar salad dressing,¼ cup red wine vinegar,½ cup grated Parmesan cheese,1 head romaine lettuce - rinsed, dried and shredded,1 large tomato, chopped","[{'465': 'Calories'}, {'16g': 'Fat'}, {'48g': 'Carbs'}, {'29g': 'Protein'}]",,,,Chicken Caesar Pasta,,
,,"Bring a large pot of lightly salted water to a boil. Add ziti pasta, and cook until al dente, about 8 minutes; drain.,Meanwhile, brown ground beef and onion in a large skillet over medium heat; stir in spaghetti sauce and simmer for 15 minutes.,Preheat the oven to 350 degrees F (175 degrees C). Butter a 9x13-inch baking dish.,Spread 1/2 of the ziti in the bottom of the prepared dish; top with Provolone cheese, sour cream, 1/2 of the meat sauce, remaining ziti, mozzarella cheese, and remaining meat sauce. Top with grated Parmesan cheese.,Bake in the preheated oven until heated through and cheeses have melted, about 30 minutes.",,,"1 pound dry ziti pasta,1 onion, chopped,1 pound lean ground beef,2 (26 ounce) jars spaghetti sauce,6 ounces provolone cheese, sliced,1 ½ cups sour cream,6 ounces mozzarella cheese, shredded,2 tablespoons grated Parmesan cheese","[{'578': 'Calories'}, {'25g': 'Fat'}, {'58g': 'Carbs'}, {'28g': 'Protein'}]",,,,Baked Ziti,,
,,"Combine ranch dressing, sour cream, 1 teaspoon taco seasoning, and salsa in a small bowl. Cover and refrigerate until serving.,Toss chicken with remaining taco seasoning. Cover bowl loosely with wax paper or plastic wrap. Microwave chicken until chicken is heated through, about 2 to 3 minutes.,Warm tortillas in a skillet for about a minute on each side to make them pliable. Place a scoop of chicken on the tortilla and top with lettuce, tomato, green onion, olives, avocado, cheese, and a spoonful of the ranch dressing mixture.",,https://www.allrecipes.com/thmb/GvyZXkHVi5pFDEcTzxygMuyjAko=/1500x0/filters:no_upscale():max_bytes(150000):strip_icc()/972962-ranch-chicken-tacos-Deb-C-4x3-1-b9a394dfd01f4a198ca9ed7a32c5e191.jpg,"½ cup ranch dressing,¼ cup reduced-fat sour cream,1 (1 ounce) packet taco seasoning mix, divided,1 tablespoon mild chunky salsa,2 cups shredded rotisserie chicken,8 (6 inch) corn tortillas,shredded lettuce,1 tomato, chopped,4 green onions, sliced,1 (4 ounce) can sliced black olives,1 avocado - peeled, pitted and diced (Optional),1 cup shredded Colby-Monterey Jack cheese","[{'717': 'Calories'}, {'49g': 'Fat'}, {'40g': 'Carbs'}, {'31g': 'Protein'}]",,,,Ranch Chicken Tacos,,
,,"Preheat grill for high heat.,In a large bowl, mix together softened butter, olive oil, garlic, shallots, chives, salt, pepper, and paprika; add the shrimp, and toss to coat.,Lightly oil grill grate. Cook the shrimp as close to the flame as possible for 2 to 3 minutes per side, or until opaque.",,https://www.allrecipes.com/thmb/mpQinTcDubvMpv6CyMlpZZlRIBs=/1500x0/filters:no_upscale():max_bytes(150000):strip_icc()/945189-5aa94753cc6b48debcc14489964c95c1.jpg,"6 tablespoons unsalted butter, softened,¼ cup olive oil,1 tablespoon minced garlic,1 tablespoon minced shallots,2 tablespoons minced fresh chives,salt and freshly ground black pepper to taste,½ teaspoon paprika,2 pounds large shrimp - peeled and deveined","[{'303': 'Calories'}, {'22g': 'Fat'}, {'1g': 'Carbs'}, {'25g': 'Protein'}]",,,,Garlicky Appetizer Shrimp Scampi,,
